{
  "schemaVersion": 1,
  "recordKind": "E04A1E_RUNTIME_LOOKUP_API_METADATA_RECORD_PROPOSED",
  "recordOrdinal": 14,
  "proposalState": "PROPOSED_NOT_ADOPTED_NOT_A_BODY_GRANT",
  "bindingStatus": "UNBOUND_FOR_FUTURE_REVIEW",
  "candidateBinding": {
    "sourceHead": "UNBOUND",
    "comparisonBase": "UNBOUND",
    "plannedRunId": "UNBOUND",
    "scopeOwnership": "UNBOUND_ROOT_CRITERIA_REQUIRED"
  },
  "accessSelection": {
    "mode": "FULL_RECORD",
    "fields": "ALL_FIELDS_RECURSIVELY",
    "omittedFields": [],
    "sourceBodyAccess": "SEPARATE_EXACT_BODY_POLICY_REQUIRED"
  },
  "engine": {
    "root": "C:\\Program Files\\Epic Games\\UE_5.8",
    "versionFile": "Engine/Build/Build.version",
    "versionFileSha256": "EAB58750E84719489F3EE0D42D05A533CEB357EB3EE511777E9408D27A85F43C",
    "version": "5.8.3",
    "changelist": 58210709
  },
  "provenance": {
    "authorLineage": "SAME_AUTHOR_AS_API_V1_V2_NONINDEPENDENT_REINSPECTION",
    "v2": [
      {
        "path": "C:\\SWDev\\warhammer\\Warhammer_40k_UI_unreal\\.local\\planning\\E04\\proposed-runtime-lookup-api-v2-20261020T134900Z-bootstrap-code-review\\proposed-api-units.json",
        "bytes": 61015,
        "sha256": "68FCF91C7B4935152A2F77E45DEA57ED31F1C6CCE6FADBE3288C2BAC807DE2BA"
      },
      {
        "path": "C:\\SWDev\\warhammer\\Warhammer_40k_UI_unreal\\.local\\planning\\E04\\proposed-runtime-lookup-api-v2-20261020T134900Z-bootstrap-code-review\\proposed-source-units.literal.txt",
        "bytes": 156217,
        "sha256": "A521A962C2AC7BA8789DC43D78D556DD7AA641F7635109AE68BC0E8DD2378FE3"
      },
      {
        "path": "C:\\SWDev\\warhammer\\Warhammer_40k_UI_unreal\\.local\\planning\\E04\\proposed-runtime-lookup-api-v2-20261020T134900Z-bootstrap-code-review\\research.md",
        "bytes": 11000,
        "sha256": "9DD374003B9EDCCEE96B84553F4756C0D06C5DB010E0521A9BBAB7B62E3C0CB2"
      },
      {
        "path": "C:\\SWDev\\warhammer\\Warhammer_40k_UI_unreal\\.local\\planning\\E04\\proposed-runtime-lookup-api-v2-20261020T134900Z-bootstrap-code-review\\research-seal.json",
        "bytes": 1515,
        "sha256": "F365D7B5748184B4B7151C2840B40E51BB54526B28C52DE8ABDF8D160D647AAF"
      }
    ],
    "v3Supplement": {
      "path": "C:\\SWDev\\warhammer\\Warhammer_40k_UI_unreal\\.local\\planning\\E04\\proposed-runtime-lookup-api-v3-SUPPLEMENT-20261020T140500Z-bootstrap-code-review\\proposed-api-supplement-v3.json",
      "bytes": 16718,
      "sha256": "69173521F417ED9B1FC7EB5E59A7D841391130C15A57BE261634BFD981C45E7C"
    }
  },
  "inventory": {
    "wholeOriginCount": 38,
    "selectedUnitCount": 125,
    "selectedLiteralRowsWithOverlap": 4065,
    "countStatus": "PROPOSED_COMPOSED_EXACT_PHYSICAL_RANGES_NOT_FORMAL_BODY_COUNTS"
  },
  "wholeOrigins": [
    {
      "originId": "P01",
      "path": "C:\\Program Files\\Epic Games\\UE_5.8\\Engine\\Source\\Runtime\\Projects\\Private\\RapidJsonPluginLoading.cpp",
      "bytes": 7776,
      "sha256": "A3B30B3E07F695B017337D0D54D6405A8A535D41E9EDDF6D7E738F4939C3F353",
      "physicalRows": 322,
      "sourceCategory": "INSTALLED_PRIMARY_SOURCE",
      "bodyGrant": "NOT_GRANTED_BY_THIS_METADATA_RECORD"
    },
    {
      "originId": "P02",
      "path": "C:\\Program Files\\Epic Games\\UE_5.8\\Engine\\Source\\Runtime\\Projects\\Private\\RapidJsonPluginLoading.h",
      "bytes": 5675,
      "sha256": "1B70BCDAC19E2B404CD78C9F2871730DA3524FD769AA2E09B2C3E0610CBCC353",
      "physicalRows": 192,
      "sourceCategory": "INSTALLED_PRIMARY_SOURCE",
      "bodyGrant": "NOT_GRANTED_BY_THIS_METADATA_RECORD"
    },
    {
      "originId": "P03",
      "path": "C:\\Program Files\\Epic Games\\UE_5.8\\Engine\\Source\\Runtime\\Core\\Public\\Misc\\CString.h",
      "bytes": 41039,
      "sha256": "BE9F2595E082C233C794C2A274201F75D55DC3712AAD76F235D916388D85EF67",
      "physicalRows": 1291,
      "sourceCategory": "INSTALLED_PRIMARY_SOURCE",
      "bodyGrant": "NOT_GRANTED_BY_THIS_METADATA_RECORD"
    },
    {
      "originId": "P04",
      "path": "C:\\Program Files\\Epic Games\\UE_5.8\\Engine\\Source\\Runtime\\Core\\Private\\Misc\\CString.cpp",
      "bytes": 12877,
      "sha256": "816B895F1755DD6C35E6C72E08219438E3164964571EE384FFC36657728E386F",
      "physicalRows": 196,
      "sourceCategory": "INSTALLED_PRIMARY_SOURCE",
      "bodyGrant": "NOT_GRANTED_BY_THIS_METADATA_RECORD"
    },
    {
      "originId": "P05",
      "path": "C:\\Program Files\\Epic Games\\UE_5.8\\Engine\\Source\\Runtime\\Core\\Public\\Containers\\UnrealString.h",
      "bytes": 8550,
      "sha256": "76328CA4DFEC744F1A2E05E67010F5628D028967A9333D06F1C8F5A0BD85C3E2",
      "physicalRows": 304,
      "sourceCategory": "INSTALLED_PRIMARY_SOURCE",
      "bodyGrant": "NOT_GRANTED_BY_THIS_METADATA_RECORD"
    },
    {
      "originId": "P06",
      "path": "C:\\Program Files\\Epic Games\\UE_5.8\\Engine\\Source\\Runtime\\Core\\Public\\Containers\\UnrealString.h.inl",
      "bytes": 97876,
      "sha256": "D7C3F34C038D77855D5332D5DF2FB36CA583578BA085CB5AC72C3A89EB5A7996",
      "physicalRows": 2298,
      "sourceCategory": "INSTALLED_PRIMARY_SOURCE",
      "bodyGrant": "NOT_GRANTED_BY_THIS_METADATA_RECORD"
    },
    {
      "originId": "P07",
      "path": "C:\\Program Files\\Epic Games\\UE_5.8\\Engine\\Source\\Runtime\\Core\\Public\\Misc\\UEOps.h",
      "bytes": 14289,
      "sha256": "44DF4E5ACB454393560EB0B0BDA7C3443D98377AAE0E8B80FE63F12A38B1B225",
      "physicalRows": 366,
      "sourceCategory": "INSTALLED_PRIMARY_SOURCE",
      "bodyGrant": "NOT_GRANTED_BY_THIS_METADATA_RECORD"
    },
    {
      "originId": "P08",
      "path": "C:\\Program Files\\Epic Games\\UE_5.8\\Engine\\Source\\Runtime\\Core\\Public\\Containers\\ContainersFwd.h",
      "bytes": 5091,
      "sha256": "621A2BE80CD7292B06E59F086E173C5E0290123CF714529035E12DFC3DC4916F",
      "physicalRows": 93,
      "sourceCategory": "INSTALLED_PRIMARY_SOURCE",
      "bodyGrant": "NOT_GRANTED_BY_THIS_METADATA_RECORD"
    },
    {
      "originId": "P09",
      "path": "C:\\Program Files\\Epic Games\\UE_5.8\\Engine\\Source\\Runtime\\Core\\Public\\Containers\\Map.h",
      "bytes": 14090,
      "sha256": "D7E8721135C55669DFE46AC6F0D7FD15E0C1AB8DCCD23CC4123CEE81A8AA4218",
      "physicalRows": 447,
      "sourceCategory": "INSTALLED_PRIMARY_SOURCE",
      "bodyGrant": "NOT_GRANTED_BY_THIS_METADATA_RECORD"
    },
    {
      "originId": "P10",
      "path": "C:\\Program Files\\Epic Games\\UE_5.8\\Engine\\Source\\Runtime\\Core\\Public\\Containers\\Map.h.inl",
      "bytes": 66188,
      "sha256": "8ABBAC8D11E3988601A7E226E3ED3A082CDA2CEEF783A90D0434FAD32B1153D0",
      "physicalRows": 1862,
      "sourceCategory": "INSTALLED_PRIMARY_SOURCE",
      "bodyGrant": "NOT_GRANTED_BY_THIS_METADATA_RECORD"
    },
    {
      "originId": "P11",
      "path": "C:\\Program Files\\Epic Games\\UE_5.8\\Engine\\Source\\Runtime\\Core\\Public\\Containers\\Set.h",
      "bytes": 1338,
      "sha256": "134EC528DAB0CF2F7124A765FA6DE1EFDA90F12DE99FDA84099D085EF1349CF2",
      "physicalRows": 42,
      "sourceCategory": "INSTALLED_PRIMARY_SOURCE",
      "bodyGrant": "NOT_GRANTED_BY_THIS_METADATA_RECORD"
    },
    {
      "originId": "P12",
      "path": "C:\\Program Files\\Epic Games\\UE_5.8\\Engine\\Source\\Runtime\\Core\\Public\\Containers\\SparseSet.h.inl",
      "bytes": 60839,
      "sha256": "946E30739B523BC7A20A3C78C95C9A9216D6A99FD5839B82B3D318CF66C88408",
      "physicalRows": 1855,
      "sourceCategory": "INSTALLED_PRIMARY_SOURCE",
      "bodyGrant": "NOT_GRANTED_BY_THIS_METADATA_RECORD"
    },
    {
      "originId": "P13",
      "path": "C:\\Program Files\\Epic Games\\UE_5.8\\Engine\\Source\\Runtime\\Core\\Public\\Containers\\CompactSet.h.inl",
      "bytes": 62261,
      "sha256": "AA982B5D04AD19717A5FEF254DAE7507F992838EF6ADB257CB0064214FC9B856",
      "physicalRows": 1819,
      "sourceCategory": "INSTALLED_PRIMARY_SOURCE",
      "bodyGrant": "NOT_GRANTED_BY_THIS_METADATA_RECORD"
    },
    {
      "originId": "P14",
      "path": "C:\\Program Files\\Epic Games\\UE_5.8\\Engine\\Source\\Runtime\\Core\\Public\\Misc\\Crc.h",
      "bytes": 11019,
      "sha256": "33F0C99B49EAB356C6877E4B5A3E7B29DFFCBE1115B692B74CDA727B2E67EF35",
      "physicalRows": 331,
      "sourceCategory": "INSTALLED_PRIMARY_SOURCE",
      "bodyGrant": "NOT_GRANTED_BY_THIS_METADATA_RECORD"
    },
    {
      "originId": "P15",
      "path": "C:\\Program Files\\Epic Games\\UE_5.8\\Engine\\Source\\Runtime\\Core\\Public\\Misc\\Char.h",
      "bytes": 9190,
      "sha256": "B0A3B64758CADDF5151A0396FDB042476BBA4D9C9D1EAAEDA94318B4B069A0E1",
      "physicalRows": 360,
      "sourceCategory": "INSTALLED_PRIMARY_SOURCE",
      "bodyGrant": "NOT_GRANTED_BY_THIS_METADATA_RECORD"
    },
    {
      "originId": "P16",
      "path": "C:\\Program Files\\Epic Games\\UE_5.8\\Engine\\Source\\Runtime\\Core\\Private\\GenericPlatform\\GenericPlatformStricmp.cpp",
      "bytes": 8485,
      "sha256": "919AE6E2F1C55E04043D736C1B150B632C07183720C7FD6BE0AB5D470168AE2C",
      "physicalRows": 194,
      "sourceCategory": "INSTALLED_PRIMARY_SOURCE",
      "bodyGrant": "NOT_GRANTED_BY_THIS_METADATA_RECORD"
    },
    {
      "originId": "P17",
      "path": "C:\\Program Files\\Epic Games\\UE_5.8\\Engine\\Source\\Runtime\\Core\\Public\\Windows\\WindowsPlatformString.h",
      "bytes": 2417,
      "sha256": "15186DC5762C0B628030F94CB6624E13CBAEC2BA015ECA40B4CF53F9605E7F14",
      "physicalRows": 71,
      "sourceCategory": "INSTALLED_PRIMARY_SOURCE",
      "bodyGrant": "NOT_GRANTED_BY_THIS_METADATA_RECORD"
    },
    {
      "originId": "P18",
      "path": "C:\\Program Files\\Epic Games\\UE_5.8\\Engine\\Source\\Runtime\\Core\\Public\\Microsoft\\MicrosoftPlatformString.h",
      "bytes": 14370,